{
  "meta": { "title": "Placeholder Dungeon", "width": 800, "height": 600 },
  "movementType": "topdown_8dir",
  "theme": "dungeon",
  "world": {
    "tileSize": 32,
    "backgroundColor": "#1d1d2b",
    "bounds": { "width": 1600, "height": 1200 },
    "groundTile": "tile_ground",
    "walls": [
      { "x": 0, "y": 0, "width": 1600, "height": 32 },
      { "x": 0, "y": 1168, "width": 1600, "height": 32 },
      { "x": 0, "y": 0, "width": 32, "height": 1200 },
      { "x": 1568, "y": 0, "width": 32, "height": 1200 },

      { "x": 400, "y": 200, "width": 32, "height": 300 },
      { "x": 800, "y": 500, "width": 300, "height": 32 },
      { "x": 1100, "y": 200, "width": 32, "height": 400 },
      { "x": 200, "y": 800, "width": 400, "height": 32 }
    ]
  },
  "player": {
    "start": { "x": 100, "y": 100 },
    "sprite": "player",
    "health": 10,
    "speed": 180,
    "attack": {
      "type": "melee",
      "damage": 1,
      "range": 40,
      "cooldown": 350
    }
  },
  "entities": [
    {
      "id": "patrol_1",
      "type": "enemy",
      "sprite": "enemy_patrol",
      "position": { "x": 300, "y": 300 },
      "behavior": "patrol",
      "behaviorParams": {
        "speed": 60,
        "patrolPoints": [
          { "x": 220, "y": 300 },
          { "x": 380, "y": 300 },
          { "x": 380, "y": 450 },
          { "x": 220, "y": 450 }
        ]
      },
      "health": 2,
      "damage": 1,
      "scoreValue": 10
    },
    {
      "id": "chaser_1",
      "type": "enemy",
      "sprite": "enemy_chase",
      "position": { "x": 700, "y": 300 },
      "behavior": "chase",
      "behaviorParams": { "speed": 100, "detectRadius": 260, "loseRadius": 380 },
      "health": 2,
      "damage": 1,
      "scoreValue": 15
    },
    {
      "id": "melee_1",
      "type": "enemy",
      "sprite": "enemy_chase",
      "position": { "x": 950, "y": 700 },
      "behavior": "melee",
      "behaviorParams": { "speed": 120, "detectRadius": 220, "range": 30 },
      "health": 3,
      "damage": 2,
      "scoreValue": 20
    },
    {
      "id": "flyer_1",
      "type": "enemy",
      "sprite": "enemy_flyer",
      "position": { "x": 600, "y": 900 },
      "behavior": "flying_sine",
      "behaviorParams": {
        "speed": 80,
        "amplitude": 50,
        "frequency": 2.5,
        "patrolPoints": [
          { "x": 450, "y": 900 },
          { "x": 900, "y": 900 }
        ]
      },
      "health": 1,
      "damage": 1,
      "scoreValue": 10
    },
    {
      "id": "shooter_1",
      "type": "enemy",
      "sprite": "enemy_shooter",
      "position": { "x": 1300, "y": 300 },
      "behavior": "shooter",
      "behaviorParams": { "range": 320, "fireRate": 1400, "projectileSpeed": 240, "damage": 1 },
      "health": 3,
      "damage": 0,
      "scoreValue": 20
    },
    {
      "id": "boss_1",
      "type": "boss",
      "sprite": "boss",
      "position": { "x": 1350, "y": 950 },
      "behavior": "shooter",
      "behaviorParams": { "range": 400, "fireRate": 900, "projectileSpeed": 260, "damage": 2 },
      "health": 20,
      "damage": 3,
      "scoreValue": 200
    },

    { "id": "coin_1", "type": "pickup", "sprite": "pickup_coin", "position": { "x": 300, "y": 150 }, "pickupType": "coin", "value": 5 },
    { "id": "coin_2", "type": "pickup", "sprite": "pickup_coin", "position": { "x": 900, "y": 250 }, "pickupType": "coin", "value": 5 },
    { "id": "coin_3", "type": "pickup", "sprite": "pickup_coin", "position": { "x": 1200, "y": 700 }, "pickupType": "coin", "value": 5 },
    { "id": "health_1", "type": "pickup", "sprite": "pickup_health", "position": { "x": 700, "y": 700 }, "pickupType": "health", "value": 3 },
    { "id": "health_2", "type": "pickup", "sprite": "pickup_health", "position": { "x": 1400, "y": 500 }, "pickupType": "health", "value": 3 },

    {
      "id": "guide_npc",
      "type": "npc",
      "sprite": "npc",
      "position": { "x": 200, "y": 200 },
      "behavior": "stationary",
      "message": "The boss guards the southeast chamber. Grab coins and health along the way!"
    }
  ],
  "winCondition": { "type": "defeat_boss", "targetId": "boss_1" },
  "hud": { "showHealth": true, "showScore": true, "showInventory": false }
}
